{
	"$schema": "http://json-schema.org/draft-07/schema#",
	"title": "CShift project (cshift.json)",
	"description": "Project file for `cshiftc build` / `cshiftc run`. Only \"name\" is required.",
	"type": "object",
	"required": ["name"],
	"additionalProperties": false,
	"properties": {
		"$schema": {
			"type": "string"
		},
		"name": {
			"type": "string",
			"pattern": "^[A-Za-z0-9_.-]+$",
			"description": "Project name. Used for the default output file (bin/<name>) and as module name."
		},
		"version": {
			"type": "string",
			"description": "Version of the project (informational)."
		},
		"type": {
			"enum": ["executable", "object", "library"],
			"default": "executable",
			"description": "\"executable\" links a program, \"object\" only produces an object file, \"library\" is source code that other projects use through \"dependencies\" (building it alone only checks it)."
		},
		"dependencies": {
			"type": "array",
			"items": { "type": "string" },
			"description": "Libraries this project uses: folders (or cshift.json files) of projects with \"type\": \"library\", relative to this file. Their sources, links, include paths, defines and ffiApi entries become a part of this project; a library may have dependencies itself."
		},
		"assets": {
			"type": "array",
			"items": { "type": "string" },
			"description": "Files and folders that the program reads at run time, relative to this file and inside of the project. cshiftc publish puts them into the page, where the program finds them at the same paths."
		},
		"sources": {
			"type": "array",
			"items": { "type": "string" },
			"default": ["src"],
			"description": "Source files or directories (searched recursively for *.cshift), relative to this file. All files form one program."
		},
		"output": {
			"type": "string",
			"description": "Output path relative to this file, without extension (.exe is added on Windows). Default: bin/<name>."
		},
		"optimize": {
			"type": "integer",
			"minimum": 0,
			"maximum": 3,
			"default": 2,
			"description": "Optimization level 0-3 (like -O0 ... -O3)."
		},
		"unchecked": {
			"type": "boolean",
			"default": false,
			"description": "Integer overflow wraps around instead of ending the program with a panic (like --unchecked). Division by zero and index checks stay."
		},
		"debug": {
			"type": "boolean",
			"default": false,
			"description": "Debug information (like -g): source lines and functions for gdb and lldb. Best with \"optimize\": 0."
		},
		"backend": {
			"enum": ["llvm", "m68k"],
			"description": "Code generator: \"llvm\" (LLVM IR, compiled and linked by clang) or \"m68k\" (CShift's own 68000 code generator, assembler and linker, like --backend). Default: m68k for AmigaOS targets (m68k-amigaos), llvm for all others."
		},
		"ndk": {
			"type": "string",
			"description": "The AmigaOS NDK folder (e.g. NDK3.2), relative to this file (like --ndk; the environment variable CSHIFT_NDK is used if this is not set). \"using X from \"lib.sfd\";\" finds the SFD files in <ndk>/SFD, and <ndk>/Include_H is searched for C headers on amigaos targets."
		},
		"links": {
			"type": "array",
			"items": { "type": "string" },
			"description": "Libraries passed to the linker, in addition to 'link \"name\";' directives in the sources. A plain name is a library (-l<name>); an entry with a path or a file extension (.a .o .obj .lib .so .dylib .dll) is a file linked directly, relative to this file."
		},
		"includePaths": {
			"type": "array",
			"items": { "type": "string" },
			"description": "Search paths for C headers (like -I), relative to this file. Used by 'using Name from \"header.h\";'."
		},
		"defines": {
			"type": "array",
			"items": { "type": "string" },
			"description": "Macros defined while parsing C headers (like -D), e.g. \"NAME\" or \"NAME=value\"."
		},
		"ffiApi": {
			"type": "array",
			"items": { "type": "string" },
			"description": "Headers whose path contains one of these texts belong to the API of an imported C header even if they are system headers (for umbrella headers, e.g. \"llvm-c/\")."
		},
		"libraryPaths": {
			"type": "array",
			"items": { "type": "string" },
			"description": "Search paths for the linker (like -L), relative to this file."
		},
		"target": {
			"type": "string",
			"description": "Target triple, e.g. x86_64-w64-windows-gnu, i686-linux-gnu or m68k-amigaos (an Amiga program, built with the m68k backend). Default: the host.",
			"examples": ["x86_64-w64-windows-gnu", "x86_64-linux-gnu", "i686-linux-gnu", "m68k-amigaos"]
		},
		"platforms": {
			"type": "object",
			"description": "Additions per platform, appended to the common lists when building for that platform.",
			"properties": {
				"windows": {
					"type": "object",
					"properties": {
						"links": { "$ref": "#/properties/links" },
						"includePaths": { "$ref": "#/properties/includePaths" },
						"libraryPaths": { "$ref": "#/properties/libraryPaths" },
						"defines": { "$ref": "#/properties/defines" }
					},
					"additionalProperties": false
				},
				"linux": {
					"type": "object",
					"properties": {
						"links": { "$ref": "#/properties/links" },
						"includePaths": { "$ref": "#/properties/includePaths" },
						"libraryPaths": { "$ref": "#/properties/libraryPaths" },
						"defines": { "$ref": "#/properties/defines" }
					},
					"additionalProperties": false
				},
				"macos": {
					"type": "object",
					"properties": {
						"links": { "$ref": "#/properties/links" },
						"includePaths": { "$ref": "#/properties/includePaths" },
						"libraryPaths": { "$ref": "#/properties/libraryPaths" },
						"defines": { "$ref": "#/properties/defines" }
					},
					"additionalProperties": false
				}
			},
			"additionalProperties": false
		}
	}
}
